Product ID,Name,Price,Details,Image URL
1,Classic White T-Shirt,19.99,A comfortable white t-shirt made from 100% cotton.,https://example.com/images/tshirt1.jpg
2,Blue Denim Jeans,49.99,Stylish blue denim jeans with a regular fit.,https://example.com/images/jeans1.jpg
3,Running Shoes,89.99,Lightweight running shoes with excellent cushioning.,https://example.com/images/shoes1.jpg
4,Leather Wallet,39.99,Sleek leather wallet with multiple compartments.,https://example.com/images/wallet1.jpg
5,Sports Watch,129.99,A durable sports watch with GPS and heart rate monitor.,https://example.com/images/watch1.jpg
